{
  "id": "concurrent-1756207469458",
  "title": "concurrent-1756207469458",
  "body": "Body v19",
  "priority": 29,
  "audience": "all",
  "requirement": "optional",
  "categories": [
    "test"
  ],
  "sourceHash": "24340b114ecafe683d3a2cc0867e267aa147609eea6e9526ed94e948e4364612",
  "schemaVersion": "1",
  "createdAt": "2025-08-26T11:24:29.461Z",
  "updatedAt": "2025-08-26T11:24:32.818Z",
  "riskScore": 76,
  "version": "1.0.19",
  "owner": "owner-19",
  "status": "approved",
  "priorityTier": "P1",
  "classification": "internal",
  "lastReviewedAt": "2025-08-26T11:24:29.499Z",
  "nextReviewDue": "2025-09-25T11:24:29.499Z",
  "changeLog": [
    {
      "version": "1.0.0",
      "changedAt": "2025-08-26T11:24:29.461Z",
      "summary": "initial import"
    }
  ],
  "semanticSummary": "Body v0"
}