{
  "id": "add_persist_1756149703624_1",
  "title": "add_persist_1756149703624_1",
  "body": "Body 1",
  "priority": 51,
  "audience": "all",
  "requirement": "optional",
  "categories": [
    "temp",
    "test"
  ],
  "sourceHash": "f52748fc8a9dfb6adc2dbe7e5a4171a89dbadfda31bd4b786a2dec9c81700ba8",
  "schemaVersion": "1",
  "createdAt": "2025-08-25T19:21:44.737Z",
  "updatedAt": "2025-08-25T19:21:44.737Z",
  "riskScore": 54,
  "version": "1.0.0",
  "status": "approved",
  "owner": "unowned",
  "priorityTier": "P3",
  "classification": "internal",
  "lastReviewedAt": "2025-08-25T19:21:44.737Z",
  "nextReviewDue": "2025-11-23T19:21:44.738Z",
  "changeLog": [
    {
      "version": "1.0.0",
      "changedAt": "2025-08-25T19:21:44.737Z",
      "summary": "initial import"
    }
  ],
  "semanticSummary": "Body 1"
}