{
  "id": "zz_temp_1756172271561_0",
  "title": "zz_temp_1756172271561_0",
  "body": "temp body",
  "priority": 50,
  "audience": "all",
  "requirement": "optional",
  "categories": [],
  "sourceHash": "0bd97aa1f3999c1597e67463b225bf257a15c2c4131a801c5ba4b49960a66042",
  "schemaVersion": "1",
  "createdAt": "2025-08-26T01:37:51.564Z",
  "updatedAt": "2025-08-26T01:37:51.564Z",
  "riskScore": 55,
  "version": "1.0.0",
  "status": "approved",
  "owner": "unowned",
  "priorityTier": "P3",
  "classification": "internal",
  "lastReviewedAt": "2025-08-26T01:37:51.565Z",
  "nextReviewDue": "2025-11-24T01:37:51.565Z",
  "changeLog": [
    {
      "version": "1.0.0",
      "changedAt": "2025-08-26T01:37:51.564Z",
      "summary": "initial import"
    }
  ],
  "semanticSummary": "temp body"
}