{
  "id": "defaults_fill_1756166218597",
  "title": "defaults_fill_1756166218597",
  "body": "Body defaults",
  "priority": 85,
  "audience": "all",
  "requirement": "optional",
  "categories": [
    "defaults"
  ],
  "sourceHash": "6dc43ca5dfa7ee82a07999ef72a9a02e6cec87b201b0f2dbb716e8f9f33049d3",
  "schemaVersion": "1",
  "createdAt": "2025-08-25T23:56:59.501Z",
  "updatedAt": "2025-08-25T23:56:59.501Z",
  "riskScore": 20,
  "version": "1.2.3",
  "owner": "defaults-owner",
  "status": "approved",
  "priorityTier": "P4",
  "classification": "internal",
  "lastReviewedAt": "2025-08-25T23:56:59.507Z",
  "nextReviewDue": "2025-12-23T23:56:59.507Z",
  "changeLog": [
    {
      "version": "1.2.3",
      "changedAt": "2025-08-25T23:56:59.501Z",
      "summary": "initial import"
    }
  ],
  "semanticSummary": "Body defaults"
}